{
  "$id": "https://blomics.dev/design-system/tokens.schema.json",
  "$schema": "http://json-schema.org/draft-07/schema#",
  "type": "object",
  "required": ["scales", "base"],
  "additionalProperties": false,
  "properties": {
    "$schema": { "type": "string" },
    "meta": { "$ref": "#/$defs/meta" },
    "scales": { "type": "object", "additionalProperties": { "$ref": "#/$defs/scaleRamp" } },
    "semantic": { "type": "object", "additionalProperties": { "$ref": "#/$defs/leaf" } },
    "base": { "type": "object", "additionalProperties": { "$ref": "#/$defs/leaf" } }
  },
  "$defs": {
    "leaf": { "type": "object", "required": ["light", "dark"], "additionalProperties": false, "properties": { "light": { "$ref": "#/$defs/colorRef" }, "dark": { "$ref": "#/$defs/colorRef" } } },
    "colorRef": { "type": "string", "pattern": "^(#|rgb|rgba|hsl|oklch|\\{).+" },
    "explicitRamp": { "type": "object", "minProperties": 1, "propertyNames": { "pattern": "^[0-9]{2,3}$" }, "additionalProperties": { "$ref": "#/$defs/leaf" } },
    "generateRamp": { "type": "object", "required": ["$generate"], "additionalProperties": false, "properties": { "$generate": { "type": "object", "required": ["base"], "additionalProperties": false, "properties": { "base": { "$ref": "#/$defs/leaf" }, "anchor": { "type": "integer" } } } } },
    "scaleRamp": { "oneOf": [ { "$ref": "#/$defs/explicitRamp" }, { "$ref": "#/$defs/generateRamp" } ] },
    "meta": { "type": "object", "additionalProperties": false, "properties": { "autoMirrorDark": { "type": "boolean", "default": false } } }
  }
}
